{
  "recipe_name": "prompt_1_5_ms_swift_fixture_v1",
  "framework_owner": "ms-swift",
  "dataset": {
    "output_jsonl": "prompt_1_5_ms_swift_dataset.jsonl",
    "manifest_json": "prompt_1_5_ms_swift_dataset.manifest.json",
    "dataset_name": "agentiad_prompt_1_5_fixture",
    "tools": [
      {
        "name": "PZ",
        "description": "Deterministic crop or zoom over the primary image."
      },
      {
        "name": "CR",
        "description": "Deterministic same-category normal exemplar retrieval."
      }
    ]
  },
  "training": {
    "model_id_or_path": "Qwen/Qwen2.5-VL-3B-Instruct",
    "train_type": "lora",
    "lora_rank": 8,
    "lora_alpha": 16,
    "num_train_epochs": 1,
    "per_device_train_batch_size": 1,
    "gradient_accumulation_steps": 1,
    "learning_rate": 0.0001,
    "max_length": 4096,
    "checkpoint_dir": "dist/outputs/prompt_1_5_ms_swift_checkpoints"
  },
  "logging": {
    "logging_dir": "dist/outputs/prompt_1_5_ms_swift_logs",
    "logging_steps": 1,
    "report_to": ["tensorboard"]
  },
  "resume": {
    "resume_from_checkpoint": null,
    "load_args_from_ckpt_dir": false
  }
}
